{
  "type": "raspberry_pi_zero",
  "label": "Raspberry Pi Zero",
  "category": "microcontroller",
  "description": "Raspberry Pi Zero/Zero W/Zero 2 W. Shares the same pin-compatible 40-pin GPIO layout as raspberry_pi, but is modeled separately since it's a distinct, much smaller board commonly embedded directly into a printer's electronics bay.",
  "pins": [
    { "name": "3V3", "label": "3.3V power" },
    { "name": "5V", "label": "5V power" },
    { "name": "GND", "label": "Ground" },
    { "name": "GPIO2", "label": "GPIO2 / I2C1 SDA", "group": "gpio" },
    { "name": "GPIO3", "label": "GPIO3 / I2C1 SCL", "group": "gpio" },
    { "name": "GPIO4", "label": "GPIO4 / GPCLK0", "group": "gpio" },
    { "name": "GPIO5", "label": "GPIO5", "group": "gpio" },
    { "name": "GPIO6", "label": "GPIO6", "group": "gpio" },
    { "name": "GPIO7", "label": "GPIO7 / SPI0 CE1", "group": "gpio" },
    { "name": "GPIO8", "label": "GPIO8 / SPI0 CE0", "group": "gpio" },
    { "name": "GPIO9", "label": "GPIO9 / SPI0 MISO", "group": "gpio" },
    { "name": "GPIO10", "label": "GPIO10 / SPI0 MOSI", "group": "gpio" },
    { "name": "GPIO11", "label": "GPIO11 / SPI0 SCLK", "group": "gpio" },
    { "name": "GPIO12", "label": "GPIO12 / PWM0", "group": "gpio" },
    { "name": "GPIO13", "label": "GPIO13 / PWM1", "group": "gpio" },
    { "name": "GPIO14", "label": "GPIO14 / UART TXD", "group": "gpio" },
    { "name": "GPIO15", "label": "GPIO15 / UART RXD", "group": "gpio" },
    { "name": "GPIO16", "label": "GPIO16", "group": "gpio" },
    { "name": "GPIO17", "label": "GPIO17", "group": "gpio" },
    { "name": "GPIO18", "label": "GPIO18 / PCM CLK", "group": "gpio" },
    { "name": "GPIO19", "label": "GPIO19 / PCM FS", "group": "gpio" },
    { "name": "GPIO20", "label": "GPIO20 / PCM DIN", "group": "gpio" },
    { "name": "GPIO21", "label": "GPIO21 / PCM DOUT", "group": "gpio" },
    { "name": "GPIO22", "label": "GPIO22", "group": "gpio" },
    { "name": "GPIO23", "label": "GPIO23", "group": "gpio" },
    { "name": "GPIO24", "label": "GPIO24", "group": "gpio" },
    { "name": "GPIO25", "label": "GPIO25", "group": "gpio" },
    { "name": "GPIO26", "label": "GPIO26", "group": "gpio" },
    { "name": "GPIO27", "label": "GPIO27", "group": "gpio" }
  ]
}
