{
  "type": "arduino_uno",
  "label": "Arduino Uno R3",
  "category": "microcontroller",
  "description": "Standard Arduino Uno R3 header layout (ATmega328P). Duplicate physical GND pins are collapsed into a single logical pin.",
  "pins": [
    { "name": "RESET", "label": "Reset" },
    { "name": "3V3", "label": "3.3V power" },
    { "name": "5V", "label": "5V power" },
    { "name": "VIN", "label": "Unregulated supply input" },
    { "name": "GND", "label": "Ground" },
    { "name": "A0", "label": "Analog in 0", "group": "analog" },
    { "name": "A1", "label": "Analog in 1", "group": "analog" },
    { "name": "A2", "label": "Analog in 2", "group": "analog" },
    { "name": "A3", "label": "Analog in 3", "group": "analog" },
    { "name": "A4", "label": "Analog in 4 / SDA", "group": "analog" },
    { "name": "A5", "label": "Analog in 5 / SCL", "group": "analog" },
    { "name": "D0", "label": "Digital 0 / UART RX", "group": "digital" },
    { "name": "D1", "label": "Digital 1 / UART TX", "group": "digital" },
    { "name": "D2", "label": "Digital 2", "group": "digital" },
    { "name": "D3", "label": "Digital 3 (PWM)", "group": "digital" },
    { "name": "D4", "label": "Digital 4", "group": "digital" },
    { "name": "D5", "label": "Digital 5 (PWM)", "group": "digital" },
    { "name": "D6", "label": "Digital 6 (PWM)", "group": "digital" },
    { "name": "D7", "label": "Digital 7", "group": "digital" },
    { "name": "D8", "label": "Digital 8", "group": "digital" },
    { "name": "D9", "label": "Digital 9 (PWM)", "group": "digital" },
    { "name": "D10", "label": "Digital 10 (PWM)", "group": "digital" },
    { "name": "D11", "label": "Digital 11 (PWM)", "group": "digital" },
    { "name": "D12", "label": "Digital 12", "group": "digital" },
    { "name": "D13", "label": "Digital 13 / LED_BUILTIN", "group": "digital" }
  ]
}
